{"authorization_id":null,"branch":"private_validator_only","candidate_id":null,"contract_kind":"target_vector_v1","framework_authorization_class":"fixture","hypothesis_id":null,"internal_classification":"engineering_only","native_research_outcome":false,"private_payload":{"expected_scalar":916,"generation_receipt_sha256":"8b8bb9b3bbcd5bbd5d5a99dce98e53002c391b5a0bbc7ea7e2ea18e9d3793d19","public_target_vector_sha256":"b0717f9e20527a90f86622fea0fd10440aa8bf65ed1e29597527e3748257ff8b","target_derivation_seed":"9f2af217310a51ab18837a56c86dbc0ec2215777084312c99793796b3693077b","validator_use_only":true},"provenance":{"config_sha256":"b73bf9c62205c8c4338113a04546b901f412e529a2fe4fb56a56266a60b6bae9","diff_sha256":"bfb7da9394b3d6e794aaed14e534ce8ca3e89f45628cef0d6f0ab4459f226924","producer_dependency_sha256s":["10613d2e9fd51ea095f6493013b3a2a5983ca0d9cafc67c39915a8b67e41fa51"],"source_commit":"1aba9f025950af687d9a0e5104c8642e018aeb2e","source_snapshot_sha256":"03859364a52d72594d3e7ec389d7092107d6910eeafa594d7a303ef905491026","source_tree_clean":false,"validator_dependency_sha256s":["7acc852df5a927a7954f56bd9548ec021ef0b0c92f5435e8f213363f71c72792"]},"public_payload":null,"record_kind":"lab_engineering_fixture","retainable":false,"retention_class":"engineering_only","route_effect":"none","schema_version":1,"target_vector_id":"7894d859d82f9fb557237d77d3e7bf3cf759f866c5f2f015044d9252ac9cb538"}