{"authorization_id":null,"branch":"public","candidate_id":null,"contract_kind":"target_vector_v1","framework_authorization_class":"fixture","hypothesis_id":null,"internal_classification":"engineering_only","native_research_outcome":false,"private_payload":null,"provenance":{"config_sha256":"b73bf9c62205c8c4338113a04546b901f412e529a2fe4fb56a56266a60b6bae9","diff_sha256":"bfb7da9394b3d6e794aaed14e534ce8ca3e89f45628cef0d6f0ab4459f226924","producer_dependency_sha256s":["10613d2e9fd51ea095f6493013b3a2a5983ca0d9cafc67c39915a8b67e41fa51"],"source_commit":"1aba9f025950af687d9a0e5104c8642e018aeb2e","source_snapshot_sha256":"03859364a52d72594d3e7ec389d7092107d6910eeafa594d7a303ef905491026","source_tree_clean":false,"validator_dependency_sha256s":["7acc852df5a927a7954f56bd9548ec021ef0b0c92f5435e8f213363f71c72792"]},"public_payload":{"curve_a":0,"curve_b":7,"curve_catalog_sha256":"7f125738007c5399a545ae4d0309335f0362d6feb5431c05e3d17665cdf03a0a","curve_fixture_id":"ecdlp-lab-j0-no-fp-glv-control-b11-p1613-g0","curve_id":"ecdlp-lab-j0-no-fp-glv-control-b11-p1613","field_bits":11,"field_p":1613,"generator":[364,1048],"public_scalar_interval":null,"source_kind":"committed_lab_catalog","subgroup_order":269,"subgroup_order_bits":9,"target":[668,698],"target_count":1},"record_kind":"lab_engineering_fixture","retainable":false,"retention_class":"engineering_only","route_effect":"none","schema_version":1,"target_vector_id":"42aee38cc9c640c605421c603f70ce61d076e7189949c4bc91a1597a20ca4ff6"}