{"authorization_id":null,"branch":"private_validator_only","candidate_id":null,"contract_kind":"target_vector_v1","framework_authorization_class":"fixture","hypothesis_id":null,"internal_classification":"engineering_only","native_research_outcome":false,"private_payload":{"expected_scalar":924,"generation_receipt_sha256":"488bc6bbf58582d6f255f272683ba3050cddb26f18c87f54e85fbdcb4f35dd1a","public_target_vector_sha256":"6695c628285a9a4bf865be4a4bceba392b8557e49072943b187cff4027cf430a","target_derivation_seed":"760242c78f3357cb9baf189a606b077e390a8b629045989facfb86a96654c610","validator_use_only":true},"provenance":{"config_sha256":"b73bf9c62205c8c4338113a04546b901f412e529a2fe4fb56a56266a60b6bae9","diff_sha256":"bfb7da9394b3d6e794aaed14e534ce8ca3e89f45628cef0d6f0ab4459f226924","producer_dependency_sha256s":["10613d2e9fd51ea095f6493013b3a2a5983ca0d9cafc67c39915a8b67e41fa51"],"source_commit":"1aba9f025950af687d9a0e5104c8642e018aeb2e","source_snapshot_sha256":"03859364a52d72594d3e7ec389d7092107d6910eeafa594d7a303ef905491026","source_tree_clean":false,"validator_dependency_sha256s":["7acc852df5a927a7954f56bd9548ec021ef0b0c92f5435e8f213363f71c72792"]},"public_payload":null,"record_kind":"lab_engineering_fixture","retainable":false,"retention_class":"engineering_only","route_effect":"none","schema_version":1,"target_vector_id":"136ff46439adf0ab55bd513ba01432f51c5251b009a3e560df3a3008f6826f14"}