{
  "authorization_id": null,
  "branch": "public",
  "candidate_id": null,
  "contract_kind": "target_vector_v1",
  "framework_authorization_class": "fixture",
  "hypothesis_id": null,
  "internal_classification": "engineering_only",
  "native_research_outcome": false,
  "private_payload": null,
  "provenance": {
    "config_sha256": "536a86cc289e5e296afe69aea548cb317b50e0af6e17a61419bb3f02b6799bff",
    "diff_sha256": null,
    "producer_dependency_sha256s": ["2222222222222222222222222222222222222222222222222222222222222222"],
    "source_commit": "0123456789abcdef0123456789abcdef01234567",
    "source_snapshot_sha256": "1111111111111111111111111111111111111111111111111111111111111111",
    "source_tree_clean": true,
    "validator_dependency_sha256s": ["3333333333333333333333333333333333333333333333333333333333333333"]
  },
  "public_payload": {
    "curve_a": 0,
    "curve_b": 7,
    "curve_catalog_sha256": "d293afa7e5b614f39ed00356e35ee81a400b57ee9656907170193cb3aca0bbd7",
    "curve_fixture_id": "toy-secp-j0-b13-c0-p5923",
    "curve_id": "toy-secp-j0-b13-c0-p5923",
    "field_bits": 13,
    "field_p": 5923,
    "generator": [3665, 430],
    "public_scalar_interval": null,
    "source_kind": "read_only_legacy_catalog",
    "subgroup_order": 5827,
    "subgroup_order_bits": 13,
    "target": [3665, 430],
    "target_count": 1
  },
  "record_kind": "lab_engineering_fixture",
  "retainable": false,
  "retention_class": "engineering_only",
  "route_effect": "none",
  "schema_version": 1,
  "target_vector_id": "f530af54bbc7c68523bef1abcf97853d7c635244c15f5c071f91857ecf8083d8"
}
